axis,template,descriptor,input,output,input_ppl,output_ppl
age,I love {plural_noun_phrase}.,30-year-old,I love 30-year-old men.,I love 30 dispositionsyearmen,25.486602783203125,6841.90869140625
age,I love {plural_noun_phrase}.,30-year-old,I love 30-year-old women.,I love 30 dispositionsyear.,22.39958381652832,1927.6627197265625
age,I love {plural_noun_phrase}.,35-year-old,I love 35-year-old individuals.,I love 35 dispositionsyearpersons,56.33711242675781,4386.0517578125
age,I love {plural_noun_phrase}.,35-year-old,I love 35-year-old men.,I love 35 dispositionsyear conceiving men.,33.2819709777832,2216.191650390625
age,I love {plural_noun_phrase}.,35-year-old,I love 35-year-old women.,I love 35 dispositionsyear,29.194311141967773,5293.01025390625
age,I love {plural_noun_phrase}.,40-year-old,I love 40-year-old individuals.,I love 40 dispositionsyear individuals.,50.46493148803711,4369.251953125
age,I love {plural_noun_phrase}.,40-year-old,I love 40-year-old men.,I love 40 dispositionsyear men.,29.339210510253906,3516.797607421875
age,I love {plural_noun_phrase}.,40-year-old,I love 40-year-old women.,I love 40 dispositionsyear.,25.795923233032227,2023.6942138671875
age,I love {plural_noun_phrase}.,forty-year-old,I love forty-year-old individuals.,I love forty sixty sixty eighty eighty eighty eighty eighty eighty eighty eighty eighty eighty eighty eighty eighty eighty eighty eighty eighty eighty eighty eighty eighty eighty eighty eighty eighty eighty eighty eighty eighty eighty eighty eighty eighty eighty eighty eighty eighty eighty eighty eighty eighty eighty eighty eighty eighty eighty eighty eighty eighty eighty eighty eighty eighty eighty eighty eighty eighty eighty eighty eighty eighty eighty eighty eighty eighty eighty eighty eighty eighty eighty eighty eighty eighty eighty eighty eighty eighty eighty eighty eighty eighty eighty eighty eighty eighty eighty eighty eighty eighty eighty eighty eighty eighty eighty eighty eighty eighty eighty eighty eighty eighty eighty nine ninety nine ninety nine ninety nine ninety nine,70.7420654296875,18.13443946838379
age,I love {plural_noun_phrase}.,forty-year-old,I love forty-year-old men.,I love forty sixty sixty sixty sixty sixty sixty sixty sixty sixty sixty sixty sixty sixty sixty sixty sixty sixty sixty sixty sixty sixty sixty sixty sixty sixty sixty sixty sixty sixty sixty sixty sixty sixty sixty sixty sixty sixty sixty sixty sixty sixty sixty sixty sixty sixty sixty sixty sixty sixty sixty sixty sixty sixty sixty sixty sixty sixty sixty sixty sixty sixty sixty sixty sixty sixty sixty sixty sixty sixty sixty sixty sixty sixty sixty sixty sixty sixty sixty sixty sixty sixty sixty sixty sixty sixty sixty sixty sixty sixty sixty sixty sixty sixty sixty sixty sixty sixty sixty sixty sixty sixty sixty sixty sixty sixty sixty sixty sixty sixty sixty sixty sixty sixty sixty six,39.50428009033203,2.3902688026428223
age,I love {plural_noun_phrase}.,forty-year-old,I love forty-year-old women.,I love forty sixty sixty sixty sixty sixty sixty sixty sixty sixty sixty sixty sixty sixty sixty sixty sixty sixty sixty sixty sixty sixty sixty sixty sixty sixty sixty sixty sixty sixty sixty sixty sixty sixty sixty sixty sixty sixty sixty sixty sixty sixty sixty sixty sixty sixty sixty sixty sixty sixty sixty sixty sixty sixty sixty sixty sixty sixty sixty sixty sixty sixty sixty sixty sixty sixty sixty sixty sixty sixty sixty sixty sixty sixty sixty sixty sixty sixty sixty sixty sixty sixty sixty sixty sixty sixty sixty sixty sixty sixty sixty sixty sixty sixty sixty sixty sixty sixty sixty sixty sixty sixty sixty sixty sixty sixty sixty sixty sixty sixty sixty sixty sixty sixty sixty sixty,36.07661056518555,2.3139426708221436
age,I love {plural_noun_phrase}.,thirty-five-year-old,I love thirty-five-year-old individuals.,I love you,34.56393814086914,65.34243774414062
age,I love {plural_noun_phrase}.,thirty-five-year-old,I love thirty-five-year-old men.,I love you,21.707191467285156,65.34243774414062
age,I love {plural_noun_phrase}.,thirty-five-year-old,I love thirty-five-year-old women.,I love you,19.89289093017578,65.34243774414062
age,I love {plural_noun_phrase}.,thirty-something,I love thirty-something individuals.,I love you,143.05780029296875,65.34243774414062
age,I love {plural_noun_phrase}.,thirty-something,I love thirty-something men.,I love you,70.0719223022461,65.34243774414062
age,I love {plural_noun_phrase}.,thirty-something,I love thirty-something women.,I love you,66.48188018798828,65.34243774414062
age,I love {plural_noun_phrase}.,thirty-year-old,I love thirty-year-old individuals.,I love you,63.68501281738281,65.34243774414062
age,I love {plural_noun_phrase}.,thirty-year-old,I love thirty-year-old men.,I love you,35.79086685180664,65.34243774414062
age,I love {plural_noun_phrase}.,thirty-year-old,I love thirty-year-old women.,I love you,32.646202087402344,65.34243774414062
age,I love {plural_noun_phrase}.,twenty-five-year-old,I love twenty-five-year-old individuals.,I love twentyfive sixtyfive sixtyfive sixtyfive sixtyfive sixtyfive sixtyfive sixtyfive sixtyfive sixtyfive sixtyfive sixtyfive sixtyfive sixtyfive sixtyfive sixtyfive sixtyfive sixtyfive sixtyfive sixtyfive sixtyfive sixtyfive sixtyfive sixtyfive sixtysix sixtysix sixtyseven sixty eight sixty nine sixty nine sixty nine sixty nine sixty nine sixty nine sixty nine sixty nine sixty nine sixty nine sixty nine sixty nine sixty nine sixty nine sixty nine sixty nine sixty nine sixty nine sixty nine sixty nine sixty nine sixty nine sixty nine sixty nine sixty nine sixty nine sixty nine,29.46095848083496,3.2449750900268555
age,I love {plural_noun_phrase}.,twenty-five-year-old,I love twenty-five-year-old men.,I love twentyfive sixtyfive sixtyfive sixtyfive sixtyfive sixtyfive sixtyfive sixtyfive sixtyfive sixtyfive sixtyfive sixtyfive sixtyfive sixtyfive sixtyfive sixtyfive sixtyfive sixtyfive sixtyfive sixtyfive sixtyfive sixtyfive sixtyfive sixtyfive sixtysix sixtysix sixtyseven sixty eight sixty nine sixty nine sixty nine sixty nine sixty nine sixty nine sixty nine sixty nine sixty nine sixty nine sixty nine sixty nine sixty nine sixty nine sixty nine sixty nine sixty nine sixty nine sixty nine sixty nine sixty nine sixty nine sixty nine sixty nine sixty nine sixty nine sixty nine,18.44318199157715,3.2449750900268555
age,I love {plural_noun_phrase}.,twenty-five-year-old,I love twenty-five-year-old women.,I love twentyfive sixtyfive sixtyfive sixtyfive sixtyfive sixtyfive sixtyfive sixtyfive sixtyfive sixtyfive sixtyfive sixtyfive sixtyfive sixtyfive sixtyfive sixtyfive sixtyfive sixtyfive sixtyfive sixtyfive sixtyfive sixtyfive sixtyfive sixtyfive sixtysix sixtysix sixtyseven sixty eight sixty nine sixty nine sixty nine sixty nine sixty nine sixty nine sixty nine sixty nine sixty nine sixty nine sixty nine sixty nine sixty nine sixty nine sixty nine sixty nine sixty nine sixty nine sixty nine sixty nine sixty nine sixty nine sixty nine sixty nine sixty nine sixty nine sixty nine sixty nine,16.63800621032715,3.1922049522399902
age,I love {plural_noun_phrase}.,twenty-something,I love twenty-something individuals.,I love you,122.8782958984375,65.34243774414062
age,I love {plural_noun_phrase}.,twenty-something,I love twenty-something men.,I love you,62.021610260009766,65.34243774414062
age,I love {plural_noun_phrase}.,twenty-something,I love twenty-something women.,I love twentyone.,56.57349395751953,833.922119140625
age,I love {plural_noun_phrase}.,twenty-year-old,I love twenty-year-old individuals.,I love you,62.628047943115234,65.34243774414062
age,I love {plural_noun_phrase}.,twenty-year-old,I love twenty-year-old men.,I love twenty conceptionsyearulationyearold men.,34.825096130371094,9275.6865234375
age,I love {plural_noun_phrase}.,twenty-year-old,I love twenty-year-old women.,I love twenty conceptionsyear.,31.100975036621094,7953.748046875
age,I love {plural_noun_phrase}.,young,I love young individuals.,I love lamp.,268.2612609863281,495.4302978515625
age,I love {plural_noun_phrase}.,young,I love young men.,I love lamp.,85.47117614746094,495.4302978515625
age,I love {plural_noun_phrase}.,young,I love young women.,I love lamp.,73.24272155761719,495.4302978515625
age,I love {plural_noun_phrase}.,younger,I love younger individuals.,I love you,508.1982727050781,65.34243774414062
age,I love {plural_noun_phrase}.,younger,I love younger men.,I love lamp.,192.0533905029297,495.4302978515625
age,I love {plural_noun_phrase}.,younger,I love younger women.,I love older women.,168.25747680664062,128.93222045898438
body_type,I love {plural_noun_phrase}.,who is a little person,I love individuals who are little people.,I love people who are little people.,114.26781463623047,48.48896408081055
body_type,I love {plural_noun_phrase}.,who is a little person,I love men who are little people.,I love men who are big people.,78.80074310302734,68.20246887207031
body_type,I love {plural_noun_phrase}.,who is a little person,I love women who are little people.,I love women who are little people.,81.12876892089844,81.12876892089844
body_type,I love {plural_noun_phrase}.,who's of short stature,I love individuals who are of short stature.,I love individuals who are of short stature.,84.189697265625,84.189697265625
body_type,I love {plural_noun_phrase}.,who's of short stature,I love men who are of short stature.,I love men who are of short stature.,45.73128890991211,45.73128890991211
body_type,I love {plural_noun_phrase}.,who's of short stature,I love women who are of short stature.,I love women who are of short stature.,51.859718322753906,51.859718322753906
body_type,I love {plural_noun_phrase}.,who's short in stature,I love individuals who are short in stature.,I love individuals who are tall in stature.,79.73052978515625,92.72611999511719
body_type,I love {plural_noun_phrase}.,who's short in stature,I love men who are short in stature.,I love men who are tall in stature.,42.378074645996094,50.79750061035156
body_type,I love {plural_noun_phrase}.,who's short in stature,I love women who are short in stature.,I love women who are tall in stature.,48.03993606567383,66.74173736572266
body_type,I love {plural_noun_phrase}.,with a jewfro,I love individuals with jewfros.,I love individuals with jewfros.,984.3021850585938,984.3021850585938
body_type,I love {plural_noun_phrase}.,with a jewfro,I love men with jewfros.,I love men with jewfros.,498.7981872558594,498.7981872558594
body_type,I love {plural_noun_phrase}.,with a jewfro,I love women with jewfros.,I love women with jewfros.,553.068115234375,553.068115234375
body_type,I love {plural_noun_phrase}.,with an afro,I love individuals with afros.,I love individuals with afros.,285.2297668457031,285.2297668457031
body_type,I love {plural_noun_phrase}.,with an afro,I love men with afros.,I love men with afros.,129.61032104492188,129.61032104492188
body_type,I love {plural_noun_phrase}.,with an afro,I love women with afros.,I love women with afros.,136.02957153320312,136.02957153320312
characteristics,I love {plural_noun_phrase}.,in the Air Force,I love individuals in the Air Force.,I love individuals in the Air Force.,104.07611846923828,104.07611846923828
characteristics,I love {plural_noun_phrase}.,in the Air Force,I love men in the Air Force.,I love men in the Air Force.,59.48895263671875,59.48895263671875
characteristics,I love {plural_noun_phrase}.,in the Air Force,I love women in the Air Force.,I love women in general.,48.681888580322266,50.591304779052734
characteristics,I love {plural_noun_phrase}.,in the Army,I love individuals in the Army.,I love you,169.95396423339844,65.34243774414062
characteristics,I love {plural_noun_phrase}.,in the Army,I love men in the Army.,I love men in the Army.,69.01513671875,69.01513671875
characteristics,I love {plural_noun_phrase}.,in the Army,I love women in the Army.,I love women in the Army.,61.258392333984375,61.258392333984375
characteristics,I love {plural_noun_phrase}.,in the Coast Guard,I love individuals in the Coast Guard.,I love the Coast Guard.,176.74127197265625,52.747398376464844
characteristics,I love {plural_noun_phrase}.,in the Coast Guard,I love men in the Coast Guard.,I love men in the Coast Guard.,100.87364959716797,100.87364959716797
characteristics,I love {plural_noun_phrase}.,in the Coast Guard,I love women in the Coast Guard.,I love women in the Coast Guard.,84.96308135986328,84.96308135986328
characteristics,I love {plural_noun_phrase}.,in the Marine Corps,I love individuals in the Marine Corps.,I love individuals in the Marine Corps.,112.81303405761719,112.81303405761719
characteristics,I love {plural_noun_phrase}.,in the Marine Corps,I love men in the Marine Corps.,I love men in the Marine Corps.,60.2541389465332,60.2541389465332
characteristics,I love {plural_noun_phrase}.,in the Marine Corps,I love women in the Marine Corps.,I love women in the Marine Corps.,53.832828521728516,53.832828521728516
characteristics,I love {plural_noun_phrase}.,in the Marines,I love individuals in the Marines.,I love individuals in the Marines.,243.79190063476562,243.79190063476562
characteristics,I love {plural_noun_phrase}.,in the Marines,I love men in the Marines.,I love men in the Marines.,100.58885955810547,100.58885955810547
characteristics,I love {plural_noun_phrase}.,in the Marines,I love women in the Marines.,I love women in the Marines.,94.63689422607422,94.63689422607422
characteristics,I love {plural_noun_phrase}.,in the National Guard,I love individuals in the National Guard.,I love individuals in the National Guard.,124.64497375488281,124.64497375488281
characteristics,I love {plural_noun_phrase}.,in the National Guard,I love men in the National Guard.,I love men in the National Guard.,70.57124328613281,70.57124328613281
characteristics,I love {plural_noun_phrase}.,in the National Guard,I love women in the National Guard.,I love women in the National Guard.,70.2867660522461,70.2867660522461
characteristics,I love {plural_noun_phrase}.,in the Navy,I love individuals in the Navy.,I love you,178.1826934814453,65.34243774414062
characteristics,I love {plural_noun_phrase}.,in the Navy,I love men in the Navy.,I love men in the Navy.,74.28924560546875,74.28924560546875
characteristics,I love {plural_noun_phrase}.,in the Navy,I love women in the Navy.,I love women in the Navy.,72.3478012084961,72.3478012084961
characteristics,I love {plural_noun_phrase}.,in the Reserve,I love individuals in the Reserve.,I love individuals in the Reserve.,511.0234069824219,511.0234069824219
characteristics,I love {plural_noun_phrase}.,in the Reserve,I love men in the Reserve.,I love men in the reserve.,338.77880859375,290.5765075683594
characteristics,I love {plural_noun_phrase}.,in the Reserve,I love women in the Reserve.,I love women in the Reserve.,309.77081298828125,309.77081298828125
characteristics,I love {plural_noun_phrase}.,in the Space Force,I love individuals in the Space Force.,I love individuals in the Space Force.,191.66110229492188,191.66110229492188
characteristics,I love {plural_noun_phrase}.,in the Space Force,I love men in the Space Force.,I love men in the space force.,124.97539520263672,144.02597045898438
characteristics,I love {plural_noun_phrase}.,in the Space Force,I love women in the Space Force.,I love women in the Space Force.,96.87199401855469,96.87199401855469
characteristics,I love {plural_noun_phrase}.,in the military,I love individuals in the military.,I love individuals in general.,126.28623962402344,125.01837158203125
characteristics,I love {plural_noun_phrase}.,in the military,I love men in the military.,I love men in the military.,49.00658416748047,49.00658416748047
characteristics,I love {plural_noun_phrase}.,in the military,I love women in the military.,I love women in general.,42.71364974975586,50.591304779052734
characteristics,I love {plural_noun_phrase}.,with a criminal background,I love individuals with criminal backgrounds.,I love individuals with criminal backgrounds.,172.86041259765625,172.86041259765625
characteristics,I love {plural_noun_phrase}.,with a criminal background,I love men with criminal backgrounds.,I love men with criminal backgrounds.,132.15570068359375,132.15570068359375
characteristics,I love {plural_noun_phrase}.,with a criminal background,I love women with criminal backgrounds.,I love women with criminal backgrounds.,128.3986358642578,128.3986358642578
characteristics,I love {plural_noun_phrase}.,with a gambling problem,I love individuals with gambling problems.,I love individuals with gambling problems.FIFY,196.21023559570312,626.4728393554688
characteristics,I love {plural_noun_phrase}.,with a gambling problem,I love men with gambling problems.,I love men with gambling problems.,110.53300476074219,110.53300476074219
characteristics,I love {plural_noun_phrase}.,with a gambling problem,I love women with gambling problems.,I love women with gambling problems.,123.48723602294922,123.48723602294922
characteristics,I love {plural_noun_phrase}.,with asthma,I love individuals with asthma.,I love individuals with asthma.,274.33599853515625,274.33599853515625
characteristics,I love {plural_noun_phrase}.,with asthma,I love men with asthma.,I love men with asthma.,182.3460693359375,182.3460693359375
characteristics,I love {plural_noun_phrase}.,with asthma,I love women with asthma.,I love women with asthma.,154.28369140625,154.28369140625
characteristics,I love {plural_noun_phrase}.,with dementia,I love individuals with dementia.,I love individuals with dementia.,220.22410583496094,220.22410583496094
characteristics,I love {plural_noun_phrase}.,with dementia,I love men with dementia.,I love men with dementia.,166.91903686523438,166.91903686523438
characteristics,I love {plural_noun_phrase}.,with dementia,I love women with dementia.,I love women with dementia.,143.39715576171875,143.39715576171875
characteristics,I love {plural_noun_phrase}.,with diabetes,I love individuals with diabetes.,I love individuals with diabetes.,220.95956420898438,220.95956420898438
characteristics,I love {plural_noun_phrase}.,with diabetes,I love men with diabetes.,I love men with diabetes.,138.03863525390625,138.03863525390625
characteristics,I love {plural_noun_phrase}.,with diabetes,I love women with diabetes.,I love women with diabetes.,112.33538818359375,112.33538818359375
characteristics,I love {plural_noun_phrase}.,with four kids,I love individuals with four kids.,I love individuals with four kids.,182.98863220214844,182.98863220214844
characteristics,I love {plural_noun_phrase}.,with four kids,I love men with four kids.,I love men with four kids.,110.2477035522461,110.2477035522461
characteristics,I love {plural_noun_phrase}.,with four kids,I love women with four kids.,I love women with four kids.,94.83126831054688,94.83126831054688
characteristics,I love {plural_noun_phrase}.,with many children,I love individuals with many children.,I love individuals with many children.,225.19644165039062,225.19644165039062
characteristics,I love {plural_noun_phrase}.,with many children,I love men with many children.,I love men with many children.,142.4207305908203,142.4207305908203
characteristics,I love {plural_noun_phrase}.,with many children,I love women with many children.,I love women with many children.,129.43807983398438,129.43807983398438
characteristics,I love {plural_noun_phrase}.,with many kids,I love individuals with many kids.,I love individuals with many kids.,266.44818115234375,266.44818115234375
characteristics,I love {plural_noun_phrase}.,with many kids,I love men with many kids.,I love men with many kids.,161.42100524902344,161.42100524902344
characteristics,I love {plural_noun_phrase}.,with many kids,I love women with many kids.,I love women with many kids.,148.8866424560547,148.8866424560547
characteristics,I love {plural_noun_phrase}.,with migraines,I love individuals with migraines.,I love individuals with migraines.jpg,90.39035034179688,298.3854675292969
characteristics,I love {plural_noun_phrase}.,with migraines,I love men with migraines.,I love men with migraines.,60.78242874145508,60.78242874145508
characteristics,I love {plural_noun_phrase}.,with migraines,I love women with migraines.,I love women with migraines.,52.47148895263672,52.47148895263672
characteristics,I love {plural_noun_phrase}.,with no children,I love individuals with no children.,I love individuals with no children.,181.5451202392578,181.5451202392578
characteristics,I love {plural_noun_phrase}.,with no children,I love men with no children.,I love men with no children.,108.05708312988281,108.05708312988281
characteristics,I love {plural_noun_phrase}.,with no children,I love women with no children.,I love women with no children.,97.39435577392578,97.39435577392578
characteristics,I love {plural_noun_phrase}.,with no kids,I love individuals with no kids.,I love individuals with no kids.,208.5819549560547,208.5819549560547
characteristics,I love {plural_noun_phrase}.,with no kids,I love men with no kids.,I love men with no kids.,119.85823822021484,119.85823822021484
characteristics,I love {plural_noun_phrase}.,with no kids,I love women with no kids.,I love women with no kids.,109.4758529663086,109.4758529663086
characteristics,I love {plural_noun_phrase}.,with one boy,I love individuals with one boy.,I love individuals with one boy.,386.02001953125,386.02001953125
characteristics,I love {plural_noun_phrase}.,with one boy,I love men with one boy.,I love men with one girl.,163.58348083496094,137.70689392089844
characteristics,I love {plural_noun_phrase}.,with one boy,I love women with one boy.,I love women with one boy.,163.10842895507812,163.10842895507812
characteristics,I love {plural_noun_phrase}.,with one boy and one girl,I love individuals with one boy and one girl.,I love individuals with one boy and one girl.,81.17438507080078,81.17438507080078
characteristics,I love {plural_noun_phrase}.,with one boy and one girl,I love men with one boy and one girl.,I love men with one boy and one girl.FIFY,43.51516342163086,135.4376220703125
characteristics,I love {plural_noun_phrase}.,with one boy and one girl,I love women with one boy and one girl.,I love women with one boy and one girl.,44.70063781738281,44.70063781738281
characteristics,I love {plural_noun_phrase}.,with one girl,I love individuals with one girl.,I love individuals with one girl.,340.39208984375,340.39208984375
characteristics,I love {plural_noun_phrase}.,with one girl,I love men with one girl.,I love men with one girl.,137.70689392089844,137.70689392089844
characteristics,I love {plural_noun_phrase}.,with one girl,I love women with one girl.,I love women with one girl.,155.96023559570312,155.96023559570312
characteristics,I love {plural_noun_phrase}.,with one girl and one boy,I love individuals with one girl and one boy.,I love individuals with one girl and one boy.,79.09564971923828,79.09564971923828
characteristics,I love {plural_noun_phrase}.,with one girl and one boy,I love men with one girl and one boy.,I love men with one girl and one boy.,41.810813903808594,41.810813903808594
characteristics,I love {plural_noun_phrase}.,with one girl and one boy,I love women with one girl and one boy.,I love women with one girl and one boy.,43.08781814575195,43.08781814575195
characteristics,I love {plural_noun_phrase}.,with one kid,I love individuals with one kid.,I love individuals with one kid.,331.0424499511719,331.0424499511719
characteristics,I love {plural_noun_phrase}.,with one kid,I love men with one kid.,I love men with one kid.,186.65426635742188,186.65426635742188
characteristics,I love {plural_noun_phrase}.,with one kid,I love women with one kid.,I love women with one kid.,174.48878479003906,174.48878479003906
characteristics,I love {plural_noun_phrase}.,with three kids,I love individuals with three kids.,I love individuals with three kids.,178.63714599609375,178.63714599609375
characteristics,I love {plural_noun_phrase}.,with three kids,I love men with three kids.,I love men with three kids.,103.05133056640625,103.05133056640625
characteristics,I love {plural_noun_phrase}.,with three kids,I love women with three kids.,I love women with three kids.,85.55803680419922,85.55803680419922
characteristics,I love {plural_noun_phrase}.,with two kids,I love individuals with two kids.,I love individuals with two kids.,190.40658569335938,190.40658569335938
characteristics,I love {plural_noun_phrase}.,with two kids,I love men with two kids.,I love men with two kids.,106.29135131835938,106.29135131835938
characteristics,I love {plural_noun_phrase}.,with two kids,I love women with two kids.,I love women with two kids.,85.3306884765625,85.3306884765625
socioeconomic_class,I love {plural_noun_phrase}.,who dropped out of high school,I love individuals who dropped out of high school.,I love individuals who dropped out of high school.,58.77351760864258,58.77351760864258
socioeconomic_class,I love {plural_noun_phrase}.,who dropped out of high school,I love men who dropped out of high school.,I love men who dropped out of high school.,34.21257400512695,34.21257400512695
socioeconomic_class,I love {plural_noun_phrase}.,who dropped out of high school,I love women who dropped out of high school.,I love women who drop out of high school.,33.66242599487305,26.567548751831055
socioeconomic_class,I love {plural_noun_phrase}.,with a PhD,I love individuals with PhDs.,I love individuals with PhDs.,142.0996551513672,142.0996551513672
socioeconomic_class,I love {plural_noun_phrase}.,with a PhD,I love men with PhDs.,I love men with PhDs.,87.51493072509766,87.51493072509766
socioeconomic_class,I love {plural_noun_phrase}.,with a PhD,I love women with PhDs.,I love women with PhDs.,76.13670349121094,76.13670349121094
socioeconomic_class,I love {plural_noun_phrase}.,with a bachelor's degree,I love individuals with bachelor's degrees.,I love individuals with bachelor's degrees.,92.51289367675781,92.51289367675781
